구분,질문,답변
전세,"['제가 2020년 2월 12일 부터 2022년 2월 11일까지 원룸 전세계약을 했습니다. 집주인분은 부동산에 모든 일을 일임한 상태여서 집주인분과는 한번도 연락해 본적이 없습니다.집주인분, 부동산에서 연락이 없어 묵시적 연장 되겠거니 하다가2021년 12월 29일에 혹시나 하는 마음에 제가 먼저 부동산에 연락했더니제가 살고있는곳에 자기 동생(집주인 동생이 아니고 부동산 직원 동생입니다).이 들어올꺼라고 하더라고요....지금 이 상황에서 제가 계약갱신 요구 할 수 있나요?할 수 있다면 집주인한테 직접 얘기를 해야하나요 아니면 부동산에 해도 되나요?(집주인분께서는 부동산에 전세관련 일을 일임한 상태입니다.)답변 부탁드립니다.\n']",['지금 이 상황에서 제가 계약갱신 요구 할 수 있나요?\n<답변> 갱신요구할 수 있습니다.\n2020년 12월 10일 전의 계약이라서 1개월 전에 하면 됩니다.\n집주인이 직접 거주한다고 안 했으니 갱신요구할 수 있습니다.\n할 수 있다면 집주인한테 직접 얘기를 해야하나요 아니면 부동산에 해도 되나요?\n(집주인분께서는 부동산에 전세관련 일을 일임한 상태입니다.)\n<답변> 집주인에게 통보해야 합니다.\n부동산에게 할 필요는 없습니다.\n']
전세,"['안녕하세요 궁금한점이 있어 도움 부탁드려요.지금 전세집 (A) 인데 만기가 내년7월이에요.작년에 전세 낀 매물 자가 (B) 매수해서 올해 11월 입주인데,궁금한점이 있어서 질문드려요1. 꼭 부동산에서 (B) 세입자한테 돈 돌려줘야하나요?돈만 입금해주면 끝인지, 원본 계약서도 받아야하나요? - 이때 수고비로 부동산에 따로 내야하는게 있나요?2. 수리 후 (B) 입주 예정인데 세입자 나가면, 당일날 행복센터가서 전입신고 등본 변경해야 하나요? - (A) 전세집도 안나가서 전입신고 두곳 가능한가요?3. 아직 전세집 (A)가 안빠져서 내년까지 빈집으로 둬도 상관없나요? - 집주인한테 빈집이라 알려야 하나요?4. (A) 전세 집주인이 전세가 아닌 매매한다고 하면, 계약일 보다 빨리 나가도 따로 제가 복비 안내도 되는건가요? 5. (B) 자가는 입주 후에 언제든지 매도 가능한건가요? 실거주 해야하는 기간이 있나요?\n']",['']
전세,['전세사기를 당한거 같아요 근데 부동산도 한통속인거같아서 부동산걸고 넘어지려고해요ㅠㅠ첨에 계약할때도 저희는 건물주인줄 알았는데 이사하고 보니까 처남이였고 위임장도 못받았어요 부동산은 큰문제가 아닐꺼같아서 얘기를 안했대요ㅜㅜ그리고 부동산 전화번호도 잘못써져있고 임대인 주소도 잘못써져있고 임대인 사인에는 건물주이름인데 번호는 처남으로 돼있습니다 일부로 그런건지 참 이상하네요이거에 대해서 소송을 준비할수있을까요?! 건물경매에 넘어갔는데 연락도 안되고 계속 빚갚는다고만 반복이네요 도와주세요ㅠㅠ\n'],"['계약당시부터 전세보증금을\n반환할 의사나 능력이 없으면서\n전세계약을 체결했다면 사기죄에\n해당합니다.\n질문사항만으로는 정확히 사실관계를\n알 수없군요.\n질문자님이  봐서 처음 전세계약할 때부터\n전세보증금을 반환할 생각없이\n경매를 염두에 두고 전세계약을\n했을거라는 확증이 있으면 경찰서에\n고소하세요\n그리고 집주인대신 처남이 대신 와서\n계약을 체결했다고 하셨는데\n제가 보기에는 실제 집주인은 처남이고\n명의만 매형이름으로 해놨을 가능성이\n굉장히 높습니다.\n즉, 전세사기라면 처남이 주범일 가능성이\n높다는 얘기지요.\n계약서 상의 소소한 기재오류는 계약이 성립\n하는데 별 문제가 없습니다.\n임대인(매형)이 자기가한 계약이 아니기\n때문에 전세계약을 부인한다면 모를까\n그렇지 않는 이상은 위임장없이 계약서를\n작성해도 큰 문제는 없습니다.\n부동산중개인의 책임을 묻기 위해서는\n다음 두가지 경우가 있습니다.\n첫째\n집주인의 위임장도 없이 처남과 계약서를\n작성해서 이에 집주인이 계약의 효력을 부인할\n때에는 부동산중개인에게 책임을\n물을 수 있습니다\n이 경우 중개소에서 가입한 보증보험에서\n보험금을 탈 수 있습니다.(1억한도)\n그런데 집주인이 처남이 한 계약을 인정하면\n부동산중개소의 책임을 물을 수 없습니다.\n둘째\n부동산중개인이 전세사기의 정황을 알고\n전세계약을 중개했다면 전세사기의\n공범이 됩니다\n이것이 증명되면 중개소에서 가입한\n보증보험에서 1억한도 내에서 배상을\n받을 수 있습니다.\n']"
전세,['신탁 등기된 부동산 전세계약을 하려고 합니다.\xa0 신탁사와 우선수익자의 동의 있는 상태로 전세계약 체결하면혹시나 공매나 경매넘어가게 되더라도 저는 대항력이 발생하게 되는 걸까요?\n'],['신탁사와 우선수익자의 동의 있는 상태로 전세계약 체결하면\n혹시나 공매나 경매넘어가게 되더라도 저는 대항력이 발생하게 되는 걸까요?\n=> 네. 임대계약 체결 동의서를 받아서 적법하게 계약이 진행된다면\n임차인은 확정일자 및 전입신고를 완료하여 대항력을 확보할 수 있을 것으로 보입니다.\n']
전세,"['은행에서 전세자금대출을 받아2022.7월 아파트 전세계약 후 2024.7월까지가 계약기간입니다.관련 올해 은행대출 보증금 한도가 조정되어(기존 한도 2억, 현재한도3억) 보증금을 올려서 계약서를 바꾸고싶은데(보증금 한도때문에 현재 반전세로 계약 중) 은행에서 대출승인이 된다면제가 부동산에서 해야되는것이 어떤것이 있을까요1. 기존계약서에 특약식으로 보증금만 조정해서계약서를 수정하면 되는것인지2. 계약서를 다시 작성해야하는지3. 복비는 얼마나 나오는지 등등 궁금합니다.\n']",['1. 기존계약서에 특약식으로 보증금만 조정해서\n계약서를 수정하면 되는것인지\n2. 계약서를 다시 작성해야하는지\n<답변> 금액이 바뀌면 계약서를 다시 작성해야 합니다.\n종전 계약서에는 수정하면 안 됩니다.\n3. 복비는 얼마나 나오는지 등등 궁금합니다.\n<답변> 대서료 5만원 정도 달라고 합니다.\n']
전세,"['내용이 좀 깁니다 읽어주셔서 감사합니다부동산 전세계약 관련 질문이 있습니다 지역은 전라남도 광주 입니다 -질문을 올리게 된 이유-집을 샀는데 직장을 타지역으로 잡아 전세로 내놓고 있습니다이번 12월에 기본 2년 계약기간이 끝나서 나가달라 했더니계속 살고 싶다며 말씀하셨습니다 [추가로 1년 반부터 이야기 드려서 정리할테니 나가달라 했는데 그땐 무시하셨고 1년, 8개월, 그때마다 연락을 드리다가 6개월 남은 시점에 연락이 되서 더 살겠다고 하셨습니다] 그래서 그럼 계약갱신청구권 써라 그러면 된다 해서 계약날짜까지 잡았는데오늘 갑자기 전화가 와서 구지 재계약을 할 필요가 있느냐?기본 5년 계약인데 왜 2년 밖에 안됬는데 왜 재계약을 하려 하느냐 였습니다계약서엔 2년으로 계약을 했는데 뭐가 문제가 있느냐?? 했더니\xa0그건 변동사항이 있을 때 이야기고 지금 변동사항이 없지 않느냐? 하며\xa0[전세자 보호법을 말씀하시면서 기본 5년]이라고 하시더라구요있다 나는 계약을 원하지 않는데 전세자가 원하니 하는거 아니냐 했더니그건 기본 5년에 해당 되는거니 아직 5년 아니니까 변동이 없으며구조적 문제나 전세금을 올리는 것도 아닌데 구지 할 필요가 있느냐 였습니다\xa0그러면서 자신도 세를 내놓고 있으며[상가인지 주택인지 잘 모르겠습니다]\xa0기본 5년은 보장 받을 수 있다고 하시면서 구지 재계약 할거냐 라고 하셨습니다그래도 재계약은 해야 하는게 서로 좋지 않겠냐 했더니그럼 재계약 후 내보낼거냐 라고 물어보시길래 그건 2년의 시간이 있으니천천히 생각해보자 라고 해서 마무리 지며 통화는 끝났습니다이 상황을 보면서 제가 알고 있는 지식엔\xa0기본 2년 계약갱신 2년 해서 총 4년간 전세자가 그 집에서 유지할 수 있는 건 알았는데\xa0뜬금없이 기본 5년을 제시하더라구요[[??? 기본 5년??? 저는 이게 이해가 안됬습니다 ]]그래서 이거 때문에 질문을 올렸습니다질문 드립니다1. 전라남도 지역은 아파트 또는 빌라 등 주택을 전세를 내놓으면 기본 5년이 보장 되는건가요??그리고 계약갱신청구권을 써서 더 연장 되는 구조인가요??2. 부동산 계약할 떄 특별히 특이사항에 적지 않으면기본 2년 계약갱신청구권 2년 해서 총 4년 그건 전지역에 해당되는거 아닌가요??3. 상가는 기본 5년이 보장되나요?읽어주셔서 감사합니다내공 100 입니다 저한텐 나름 급하면서 궁금한 내용입니다명확한 답변 감사합니다\n']","['질문 드립니다\n1. 전라남도 지역은 아파트 또는 빌라 등 주택을 전세를 내놓으면 기본 5년이 보장 되는건가요??\n그리고 계약갱신청구권을 써서 더 연장 되는 구조인가요??\n답변> 계약기간은 계약서에 써 놓은 기간이 계약기간이면, 2년 미만으로 계약서를 쓴 경우에 임차인은 2년 거주를 주장할 수 있습니다.(임대인은 안됩니다.)\n2. 부동산 계약할 떄 특별히 특이사항에 적지 않으면\n기본 2년 계약갱신청구권 2년 해서 총 4년 그건 전지역에 해당되는거 아닌가요??\n답변>  계약갱신 청구권은 1회 사용할 수 있으며, 그 기간은 2년입니다.(당사자 합의에 의하여 더 길게 살 수도 있음)\n3. 상가는 기본 5년이 보장되나요?\n답변>  상가는 통상 5년 계약을 하지만, 특별한 사정이 없는 한 10년 임대가 보장됩니다.\n']"
전세,['부동산 전세뜻이 큰 목돈을 주고 일정한 기간까지 살다가 나오면 돈을 그대로 받는거잖아요 그러면 예를 들어서5억에 집을사서 20년동안 사는데 20년이 지나고 집에서 나올때 5억을 다시 받는거 맞나요??\n'],['']
전세,['부동산 전세매물 집주인이 세입자에게도 부동산에 집을 여기저기 많이 내놔보라고 하시는데 혹시 이럴 경우에 내가 부동산에 집을 내놓고 거래 처리 될때 물게 되는 수수료가 있나요?\n'],['']
전세,"['부동산가서 마음에 드는 집이있고 전세대출 나올거 같은 집이있스면 가계약하기전에 등기부등본때서 은행가면 대출이 가능한집인지 그런걸 알수있나요? 계약안해도 부동산가서 마음에 드는집 등기부등본 떄주나요?가계약 후에 등기부등본을 때주고 대출심사를 받거나 해야되나요,,\n']",['']
전세,"['전세 만료 후 전세금을 못받고 나와서 등기권 설정하고 나왔습니다. 오늘 부동산에서 연락이 왔는데\xa0매매하고싶다는 사람이 있는데 등기권이 설정되어있어서 대출을 못받는다고 한다등기권 해제 가능한가?현재 본인 거주x, 등기권 설정 되어있는 상태입니다.부동산에서 집주인이랑 같이 각서 써주겠다고 하는데 둘다 각서 받고 등기권 풀어도 되는지아니면 다른 방법이 있는지 답변 부탁 드립니다 ㅠㅠ\n']","['각서는 이행 안할수도 있는 것이고, 민사로 넘어가면 소송이 언제 끝날지도 모릅니다.\n매매인 경우 대출을 못받는게 아닌데 풀어주지 마세요.\n매매 당일에 해제해 주는 조건으로 대출 받을 수 있는데 먼저 해제해 달라는 것은 이상하네요.\n돈을 먼저 받고 해제해 주어야 합니다. 대신 당일에 반드시 해제해 주세요.\n']"
전세,['안녕하세요 상당히 어리석은 질문이지만 결혼후 신혼여행을 다녀와서 전세계약까지는 했는데 잔금일이 촉박하다는걸 잊어버리고 이제야 전세대출을 알아보고 있습니다..잔금일이 9월 22일인데 이 기간까지 맞출 수 있는 상품이 어디 없을까요? 집주인께서는 잔금일을 늦출 수 없다고 하시고 저희 소중한 계약금이 날아가게 생겨버려서 어떤 방법이든 써보려합니다..9월 22일 잔금일까지 맞출 수 있는 방법을 알려주세요 부탁드리겠습니다\n'],"['무사고 소액결제 정보이용료 신용카드 소지자대출 신용카드 한도대출 정식상품권 사업자 등록업체 꿀머니에서 답변드립니다\n신용카드 한도만큼 월100만원 상관없이 신용등급 하락걱정없이 진행도 가능하실꺼에요\n부분무이자 지원 할부기간또한 선택가능한 부분이라 현금서비스의 같은경우신용등급 하락부분이 가장 걸림돌이되는 상품이죠좋은조건으로 잘 알아보셔야 하실것같습니다\n안녕하세요!\n전세계약 잔금일이 얼마 안 남은 상황이네요. 신혼여행으로 바빠서 전세대출에 대해서 지금까지 알아보지 못했다고 하셨는데, 걱정하지 마세요. 여러 가지 방법으로 잔금을 맞출 수 있는 가능성이 있습니다.\n첫 번째로, 은행이나 금융기관에 전세대출을 신청해보세요. 전세대출은 부동산 전세계약의 잔금을 갚는데 사용할 수 있는 대출 상품입니다. 은행은 잔금일까지 필요한 금액을 대출해줄 수 있으며, 상환 조건과 이자율에 대한 상담을 받아보세요.\n두 번째로, 가족이나 친구들에게 잠시 도움을 청해보세요. 긴급한 상황일 경우 가까운 분들에게 재무적인 지원을 요청할 수 있습니다. 소중한 계약금을 지키기 위해 임시로 도움을 받을 수 있는 방법이죠.\n마지막으로는 부동산 중개업체나 부동산 전문가에게 상담을 요청해보세요. 전사 경험이 있고 전문적인 도움을 받을 수 있는 사람들이 있습니다. 잔금일까지 맞출 수 있는 다양한 방법을 알고 있을 것입니다.\n잔금을 맞추는 것은 중요한 문제이지만, 여러 가지 선택지가 있으니 실망하지 마시고 대안을 찾아보세요. 언제든지 도와드릴 준비가 되어 있습니다. 힘내시고 좋은 결과가 있기를 기대합니다!\n정성스런 답변:\n♥♥♥♥답변에 만족하셨다면 채택을 추가로 궁금하신점이 있으시다면 추가질문을 부탁드리겠습니다.♥♥♥♥\n']"
전세,['안녕하세요.지금 전세를 살고 있으며 중기청을 받았습니다.(중기청80%)집주인은 계약 당일에 부동산에 다음연장때 전세금 올릴 수 있냐고 물어봤고 부동산에서는 가능하다고 하였습니다.->아마도 전세금을 올릴것 같습니다.전세금을 올리면 5%까지 올릴 수 있는거로 아는데지금 12월 21일이 계약 종료입니다.지금 저는 연장할 생각이며 집주인이나 부동산에서는 아무런 연락이 없습니다.이럴 경우 저는 그냥 중기청을 연장해도 되는지아니면 집주인에게 연장하겠다고 말을 해야하는건지알고 싶습니다.그리고 집주인도 올릴꺼면 올리겠다고 사전에 저에게 말을 해줘야하는게 맞지 않는지 궁금합니다\n'],['1. 2020년 12월10일 이후의 계약은 만기 2개월전까지 연장의 의사를 표시해야 합니다.\n2. 서로 아무 의사표시가 없었다면 묵시적갱신이 된 계약이므로 2년간 거주하면 되겠습니다.\n']
전세,['이번에 원룸 전세계약을 앞두고 있는데 이상한점이 있어 문의 드립니다. 1. 부동산 전세 계약서상에 임대인 전화번호가 부동산 전화번호로 되어 있습니다.\xa0 \xa0(부동산에서 위임장을 받았습니다. 위임자 : 부동산)※ 만약 부동산에서 위임을 받은거 이기 때문에 상관없다고 한다면 임대인과 통화라도 해야 되는게 아닌지..\xa0 \xa0임대인 전화번호를 기재해 달라고하는거에 대해서 합당한 조건인가요?2. 위임장을 받았는데 대리인 관련 서류를 받지 않았습니다. 대리인에 대한 주민등록사본이라도 받아야 되는지3. 생활숙박시설이라 보증보험 가입이 되지 않는 집인데 전입신고하고 확정일자하면 안전한건지4. 등기부등본상에 근저당권설정 11억 되어있습니다. 건물시세는 약 31억요즘 전세 사기가 많아 고민이 많습니다. ㅠㅠ\xa0전문가분들 도와주세요~\n'],"['1.위임장,임대인 개인정보 개재되어야 하고 위임장 부동산 사업자등록증 및 위임받으신분 개인정보 신분증 복사본 받으시고 임대인 연락처 필히 기재해 달라고 하세요.\n2.위에 설명한 대로 입니다. 부동산이 계약하는 거라면 부동산 사업자등록증 계약하시는분 신분증 및 개인정보 다들어가야 합니다.\n3.안전하지 않습니다. 보증보험 해도 안전하진 않습니다.\n4.시세대로 받을수 있다면 다행인데 경매가는 얼마가 될지 모르는 거니까요.\n원룸이면 크게 보증금액도 크지 않으실테고 등기나 전입세대 열람내역 다 확인해 보시고 임대인 언제 소유권 이전등기 되었는지 임대인분 어떤분인지도 알아보시는게 좋습니다. 대체로 부동산에 관리 맡긴 건물이면 임대하는 건물이라 크게 문제는 없을 듯 보이지만 전세 들어가시는 거니 기본적인 정보는 다 파악하고 계시는게 좋을것 같습니다.\n']"
전세,['동생이 전세 자취를합니다 기간은 1년반 정도 남았고4000만원 전세입니다옆집여자가 동생한테 전세금을 못돌려 받고있다고 이야기해줘서 인지한 상태입니다 등본 보실줄아시는분들사진보시고 돌려받을수있을지 계약기간이 남았으면 법적으로 할수있는게있는지 조언주시면 감사하겠습니다\n'],"['질문에 답변드리겠습니다.\n상기 질문요지를 고려할 때 등기상에는 ""근저당 28,800만원""이 있고 다른 임차인이 보증금을 되돌려 받지 못하고 있는 상태로 보입니다. 이러한 경우 집주인이 경제적인 상황이 좋지 않는 만큼 다른 물건을 알아 보시는 것이 적절해 보입니다.\n']"
전세,"['안녕하세요. 제가 궁금한게 있습니다. 혹시 전세계약 중 거주지역에 재개발이 들어올경우, 집주인은 관련 건설사에 돈을 받고 집을 파는 건가요? 그경우 제 전세 금은 어떻게 돌려받나요?\n']","['전세계약 중 거주지역에 재개발이 들어올 경우, 집주인은 일반적으로 관련 건설사에 집을 파는 경우가 많습니다. 이 경우 전세금은 일반적으로 돌려받지 못하며, 법적인 절차를 통해 보상금을 받을 수 있는 경우도 있습니다. 하지만 개별적인 상황에 따라 다를 수 있으므로, 전문가의 조언을 받는 것이 좋습니다.\n항상 좋은 일들만 가득하시길 바래요\n']"
전세,['이번에 원룸 전세계약을 앞두고 있는데 이상한점이 있어 문의 드립니다. 1. 부동산 전세 계약서상에 임대인 전화번호가 부동산 전화번호로 되어 있습니다.\xa0 \xa0(부동산에서 위임장을 받았습니다. 위임자 : 부동산)※ 만약 부동산에서 위임을 받은거 이기 때문에 상관없다고 한다면 임대인과 통화라도 해야 되는게 아닌지..\xa0 \xa0임대인 전화번호를 기재해 달라고하는거에 대해서 합당한 조건인가요?2. 위임장을 받았는데 대리인 관련 서류를 받지 않았습니다. 대리인에 대한 주민등록사본이라도 받아야 되는지3. 생활숙박시설이라 보증보험 가입이 되지 않는 집인데 전입신고하고 확정일자하면 안전한건지4. 등기부등본상에 근저당권설정 11억 되어있습니다. 건물시세는 약 31억요즘 전세 사기가 많아 고민이 많습니다. ㅠㅠ\xa0전문가분들 도와주세요~\n'],"['1.위임장,임대인 개인정보 개재되어야 하고 위임장 부동산 사업자등록증 및 위임받으신분 개인정보 신분증 복사본 받으시고 임대인 연락처 필히 기재해 달라고 하세요.\n2.위에 설명한 대로 입니다. 부동산이 계약하는 거라면 부동산 사업자등록증 계약하시는분 신분증 및 개인정보 다들어가야 합니다.\n3.안전하지 않습니다. 보증보험 해도 안전하진 않습니다.\n4.시세대로 받을수 있다면 다행인데 경매가는 얼마가 될지 모르는 거니까요.\n원룸이면 크게 보증금액도 크지 않으실테고 등기나 전입세대 열람내역 다 확인해 보시고 임대인 언제 소유권 이전등기 되었는지 임대인분 어떤분인지도 알아보시는게 좋습니다. 대체로 부동산에 관리 맡긴 건물이면 임대하는 건물이라 크게 문제는 없을 듯 보이지만 전세 들어가시는 거니 기본적인 정보는 다 파악하고 계시는게 좋을것 같습니다.\n']"
전세,['외국국적자 부동산 소유자와 전세계약시 계약서 인감증명과 인감도장날인으로 계약 해야 하는지요?부동산중개인은 서명으로해도 상관 없다는데 국내법이 있는데 이게 좀 의심스러워서요!고견을 바랍니다\n'],['외국국적자 부동산 소유자와 전세계약시 계약서 인감증명과 인감도장날인으로 계약 해야 하는지요?\n부동산중개인은 서명으로해도 상관 없다는데 국내법이 있는데 이게 좀 의심스러워서요!\n고견을 바랍니다\n=>인감증명제도를 취하는 나라는 전세계에 얼마되지 않습니다.\n외국인(대한민국인X)은 당연히 인감도장이나 인감증명서가 없겠죠???\n☜ 답변이 도움 되셨다면 채택을 눌러주세요 ☞\n']
전세,['신축 오피스텔로 맘에드는 곳이 있어서 전세 가계약을 걸어놨습니다.부모님이 아시는분이 있고 그 관련사업하시는 분을 통해 금액을 좀 낮출 수 있을수도 있다는 얘기를 들었는데 집주인이 따로 있고 내놓은 금액이 있는데 가능성이 있나요?금액이 낮아진다고 해도 제가 한 가계약과 상관이 있을까요???\n'],"['부모님의 아시는 분이 관련 사업을 하셔서 금액을 낮출 수 있는 가능성은 있지만, 집주인과의 협상이 필요하고 그 결과는 가계약에 영향을 미칠 수 있습니다. 따라서, 가능성이 있더라도 최종적인 결정은 집주인과의 협의에 따라 결정되며, 여러 요인에 따라 상이할 수 있습니다.\n']"
