구분,질문,답변
전세,['원래 계약은 7월까지인데 8월31일 까지로 미뤘었다가 다시 10월 11일로 미루게 되었습니다.첫번째 미뤘을때는 임대인이 부동산에 방문하여 잘 작성했는데 내일 다시 부동산 가서 10월11일로 미뤄야하는데임대인이 방문을 귀찮다고 거절합니다.1. 부동산에선 임대인분이 안오셔도 상관없다고 말씀 하시는데 상관이없나요?2. 전세대출이랑 보증보험 연장해야 되는데 새로운 임대차 계약서를 작성해야되는데 이경우 어떻게 해야하나요?AI 답변은 정중히 거절하겠습니다\n'],"['1. 부동산에선 임대인분이 안오셔도 상관없다고 말씀하셨다면, 임대인이 방문하지 않아도 문제 없을 것 같습니다. 다만, 임대인이 계약 변경에 동의하지 않는다면 다른 대안을 찾아보셔야 할 것 같습니다.\n2. 전세대출이나 보증보험 연장을 위해서는 새로운 임대차 계약서 작성이 필요할 수 있습니다. 부동산에 문의하여 정확한 절차를 확인하시고, 필요한 서류나 절차를 따라야 할 것입니다. 다시한번 부동산과 상담해보시는 것을 추천드립니다.\n']"
전세,['제가 돈이 필요하여 소개를 받아부동산 명의를 받아주고 사례금으로 300가량을 받았습니다명의 받았을때 살고 있던 전세 3억 2900만원 전세를 인수 받는 형식으로 했습니다(집에는 대출도 없이 깨끗합니다)전세만 있음그럼에도 300을 안주어 독촉하니 월세로 임차인과 다시계약 할거니 확정일자를 받아 달라해서 받아주고 300을 받았습니다(나중네 알고보니 위조더라거요…)그후로 집을 가져가지 않아 연락 했지만 연락이 두절되었고 결국에 나중에 알아보니 확정일자 다시 받아 대출을 하려 했다가 제가 더 안해주니 결국 포기한 모양이더군요…문제는 임대인과 계약 만료로 보증금을 주어야하는데 대출도 따로 없어서 집을 팔아 주려 했지만… 집이 팔리지 않아 전세금을 반환해주지 못하고 임차인은 hug에 보증보험으로 나갈생각인데 제가 그때 부동산에 무지해서 확정일자 허위로 받은것 때문에 hug에서 임차인이 저를 고소하면 보증 이행한대서 저를 고소했습니다….집만 팔리면 정리가 되는 상황인데(전세 3억2900 시세 3억 6000정도) 수요일 경찰 출석인데 저 형사 처벌 받은적 없습니다 어떤 처벌을 받을까요…? 전?\n'],"['안녕하세요. 서울지방변호사회 소속으로 지식iN 법률상담을 진행하고 있는 정종욱 변호사입니다.\n\u200b최근 세입자들의 소중한 보증금을 떼어먹는 전세사기가 기승을 부리고 있어 세입자들의 각별한 주의가 필요한 상황입니다. 하지만 사기꾼들의 수법이 워낙 교묘하기 때문에 조심을 한다고 하더라도 눈 뜨고 코베이는 식으로 전세사기를 당하기 십상입니다. 전세사기에 대처하는 방법으로는 (1) 형사고소, (2) 보증금반환청구소송, (3) 채권추심/강제집행이 있습니다. 이 세 가지 절차가 유기적으로 진행되어야 전세사기 사건에서 피해를 회복할 수 있습니다.\nHUG 등 전세보증보험을 가입하였다고 하더라도, 석연치 않은 이유들로 보증이행을 하지 않는 경우가 허다합니다. 보증보험회사의 입장에서도 세입자에게 보증채무를 이행한 뒤 집주인에게 구상권을 행사하여 보증금을 회수해야 하는데, 집주인으로부터 보증금회수가 불가능할 경우 이는 고스란히 보증보험회사의 손해로 귀속되기 때문입니다. 이 경우 보증금반환에 대한 부담은 고스란히 세입자가 부담하게 됩니다.\n최근 유행하는 갭투자 전세사기는 결국 갭투자 사기꾼이 남겨놓은 재산을 피해자들끼리 나눠먹기를 하는 형국으로 귀결되는 경우가 많습니다. 따라서 신속한 법적 조치를 취한 쪽이 그렇지 않은 쪽보다 유리할 수밖에 없습니다. 전세사기는 수년동안 그 형태가 진화해왔고, 그 수법이 사안마다 다르기 때문에 사안에 맞는 적절한 해결책을 찾기를 원하신다면 관련 자료를 지참해 전문 변호사와 상담을 진행해보시는 것이 좋습니다.\n참고하실만한 글을 소개해드립니다. 부동산 전세사기 대응방법에 관해서는 아래 글을 참고하시면 도움이 되실 것입니다.\n']"
전세,"['신혼부부라 이번에 전세집을 구하려고합니다그런데 아직 많이 무지해서 질문드립니다아파트 현재 매매가가 4억9천-5억5천 올려져 있는게 전세가 4억정도라면 비싼 수준인가요? 만약 그리고 최악으로 가정해서 집이 경매로 넘어간다고하면, 보증금을 돌려받을 수 있는 안전한 수준인지 궁금합니다.\n']","['아파트 매매가가 4억9천-5억5천에 올려져 있다면, 전세가 4억 정도라면 비싼 수준이라고 볼 수 있습니다.\n일반적으로 전세가 비율은 매매가의 60% 정도가 안전하다고 볼수있습니다.\n즉, 매매가가 4억9천-5억5천이라면 전세가는 2억9천4백만~3억3천만 원 정도가 적절한 수준입니다.\n시세가4.9억~5.5억이면 경매시 보증금전액을 못 받을수도있습니다.\n']"
전세,['집을 나가고자해서 알아보는 중인데요청년전월세대출이 있더라구요전세로가면 살만하지싶어서 관심이가는데이런쪽 지식이 아무것도 없습니다부동산에 청년대출을 받고싶다하면 절차나 세부사항을 안내해주시나요?전세로 살게된다면 신고절차등은 무엇을 해야하나요?또 특별히 무엇의 주의해야하거나 알아야하나요?\n'],['']
전세,"['신축빌라에 2020.8월경 전세세입자로 입주하고 나서 1년이지난뒤에야 깡통전세인걸 알았습니다. 분양당시 매매가 3억2900만원\xa0 \xa0 \xa0 \xa0 \xa0 \xa0전세가 3억2900만원\xa0이였고\xa0전세 3억2900만원 으로 안심전세대출(90%대출)을 이용해 입주하였습니다.2021.1월 중순 조금 안된시점에 집주인이 바뀌었습니다.찾아보니 전형적인 건축주와 분양사무실과 바지사장을 이용한 무갭투기 깡통전세사기 인걸 인지하여부동산 등기를 확인해보았고현재상황은 이러합니다.입주하고나서 바로 전입신고 및 확정일자를 받았고, 그이전 을구에 있던 저당권설정은그이전 건축주(집주인)의 건축당시 은행대출로 보이고,계약서에 말소조건으로 기재후입주하였고 얼마안있어서 바로 말소되었습니다.그리고 몇달뒤에 집주인이 바뀌었습니다.현재갑구에 새로바뀐 집주인(바지사장) 앞으로 압류가 건강보험공단 및 지자체징수과 압류가들어와있고,전입신고 및 확정일자는 입주와동시에 했고,지금도 거주하고있고 한번도 전출을 한이력이없습니다그이후 집주인변경 및 새집주인 압류가 들어왔으므로다행히 저는 대항력있는 선순위 임차인으로 보입니다.을구에는 현재는 아무것도 없습니다.현재 전세 만기가 7개월 정도남은 상황이고,부동산 경매 예정통지서(현재바지사장집주인앞으로)온 통지서를 받게되었는데아마도 만기이전에 집이 경매로 넘어갈것같다고 판단됩니다.-------여기서부터 질문입니다.\xa01.제가알기로 집이 경매에 넘어가도 신축빌라이므로 현재 공시가가 2억3700 나옵니다(시세조회)그러면 감정가가 어떻게 될지는몰라도 2억~2억5천사이로 예상되는데이경우에 대항력있는 선순위 임차인인 제 보증금 3억2900만원보다도 낙찰가액이 적으므로제가 배당요구를 하든하지않든 분명 무한 유찰이 될것으로 보이고,그이전에 나머지후순위채권자가신청한 경매일경우 대항력있는 선순위임차인인 제가 존재하는한말소기준권리가 저의 임차보증금이 될텐데\xa0경매가가 3억2900만원 이상이 되지않으면 무잉여기각이 될게 뻔한 상황인데이런경우에는 임차인인 제가 보증금반환소송 및 강제경매 신청후에입찰을 하고나서 낙찰가액과 배당액을 상계처리하면서인수할수 있다고 알고있는데요제가 강제경매를 신청후에 계속유찰시키면서 가장 저렴한금액으로 낙찰받아서구입하는게 나은지 아니면 첫회차에 바로 낙찰받는게 나은지 궁금합니다.2.현재 안심전세대출을 이용하고 있으므로낙찰받는순간 유주택자가 되어 안심전세대출을 일시납상환 하게되는걸로 알고있는데낙찰금액이야 상계처리하면 된다고하지만전세금상환하게 될시 어떻게 처리해야 할까요..? 이미 보유한 주택은주택담보대출도 많이 안나오는걸로 알고있습니다..3.아니면 제가 강제경매를 하지않고,채권자가 경매진행을 해도 무잉여기각이안나올수도 있을까요?4.종합적으로 봤을때 보증금 최대회수 및 이상황을 현명하게 넘길수있는 방법은 없을까요..?정말 전문가분들의 고견을 진심으로 여쭙숩니다 ..내공 많이 겁니다!!\n']","['안녕하세요. 서울지방변호사회-네이버 지식iN 상담 변호사 정종욱 입니다.\n\u200b금리인상 등으로 최근 전세집이 경매에 넘어가는 사례가 급증하고 있습니다. 전세집이 경매에 넘어간 경우 먼저 권리분석을 진행해 경매 배당절차에서 보증금 전액을 회수할 수 있는지를 따져보아야 합니다. 대항력있는 선순위 임차인이라면 낙찰자에게 보증금반환을 요구할 수 있기 때문에 상대적으로 안전한 편이지만, 최근 부동산 가격 하락으로 경매가 계속해서 유찰되는 현상이 나타나고 있습니다.\n전세보증금보험을 가입하였다고 하더라도, 석연치 않은 이유들로 보증이행을 하지 않는 경우가 허다합니다. 보증보험회사의 입장에서도 세입자에게 보증채무를 이행한 뒤 집주인에게 구상권을 행사하여 보증금을 회수해야 하는데, 집주인으로부터 보증금회수가 불가능할 경우 이는 고스란히 보증보험회사의 손해로 귀속되기 때문입니다. 이 경우 보증금반환에 대한 부담은 고스란히 세입자가 부담하게 됩니다.\n경매 배당 절차에서 보증금을 반환받지 못할 것이 확실한 경우에는 집주인을 상대로 보증금반환청구소송을 진행하신 후 신속하게 판결문을 확보해 집주인의 다른 재산에 강제집행절차를 진행하셔야 합니다. 경매 절차는 복잡한 편이고 진행과정에서 여러 변수가 많기 때문에, 보다 정확한 상담을 원하시면 관련자료를 지참해 전문 변호사와 상담을 진행해보시는 것이 좋습니다.\n전세집이 경매에 넘어가는 깡통전세는 전세사기와 밀접한 관련이 있습니다. 최근 세입자들의 소중한 보증금을 떼어먹는 전세사기가 기승을 부리고 있어 세입자들의 각별한 주의가 필요한 상황입니다. 하지만 사기꾼들의 수법이 워낙 교묘하기 때문에 조심을 한다고 하더라도 눈 뜨고 코베이는 식으로 전세사기를 당하기 십상입니다. 전세사기에 대처하는 방법으로는 (1) 형사고소, (2) 보증금반환청구소송, (3) 채권추심/강제집행이 있습니다. 이 세 가지 절차가 유기적으로 진행되어야 전세사기 사건에서 피해를 회복할 수 있습니다.\n최근 유행하는 갭투자 전세사기는 결국 갭투자 사기꾼이 남겨놓은 재산을 피해자들끼리 나눠먹기를 하는 형국으로 귀결되는 경우가 많습니다. 따라서 신속한 법적 조치를 취한 쪽이 그렇지 않은 쪽보다 유리할 수밖에 없습니다. 전세사기는 수년동안 그 형태가 진화해왔고, 그 수법이 사안마다 다르기 때문에 사안에 맞는 적절한 해결책을 찾기를 원하신다면 관련 자료를 지참해 전문 변호사와 상담을 진행해보시는 것이 좋습니다.\n참고하실만한 글을 소개해드립니다. 전세집이 경매에 넘어간 경우 대응방법, 부동산 전세사기 대응방법에 관해서는 아래 글을 참고하시면 도움이 되실 것입니다.\n']"
전세,"['2억 8천 오피스텔 전세로 들어왔고, 계약 당시 건물 등기부등본에 가압류나 근저당 없었습니다. 그 후, 확정일자랑 전입신고 다 했고요.4월이면 전세 계약이 끝나는데 집주인이 집 180채를 보유했고 그에 대한 세금 약 16억 이상을 못 냈습니다.전 4월 3일날 계약을 했고, 등기사항전부증명서를 보니 갑구 소유권 이전이 됐더라고요. (접수 2020년 4월 20일) -\xa0 등시원인 4월 1일 매매입니다.1. 제가 전세를 할 당시(4월 3일) 소유주는 A였는데 그 전 날(4월 1일)에 매매가 됐으면 A가 아니라 B가 소유주여야 하는 게 아닌가요?2. 소유권 이전 접수날인 20일 전에 확정일자랑 전입신고를 했으니 등기원인 이유와 상관없이 경매시 대항력있는 선순위 임차권이 되는 것인가요?\n']","['안녕하세요. 서울지방변호사회-네이버 지식iN 상담 변호사 정종욱 입니다.\n말씀하신 사안은 등기부등본, 주민등록초본, 임대차 계약서 등을 보아야 정확하게 판단이 가능할 것으로 보입니다. 자세한 상담을 원하시면 관련 자료를 지참해 전문 변호사와 상담을 진행하시는 것이 좋습니다. 갭투자로 다수의 부동산을 소유한 집주인에게 전세보증금을 떼이는 사례가 늘어나고 있습니다. 신속한 보증금 반환을 위해서는 필요한 법적 조치를 취하시는 것이 좋습니다.\n갭투자 전세사기 대응방법에 관해서는 아래 블로그 글을 참고하시면 도움이 되실 것입니다.\n']"
전세,"['안녕하세요내년 2월이 전세만기입니다.궁금한점은 이 집을 전세->월세로 변경하려고 하는데요임대인, 임차인 모두 변하지 않고 동일하다면이 경우 그냥 개인끼리 부동산 통하지 않고 서류를작성할경우 문제 될게 있을까요?\n']",['']
전세,['21년 11월 에 계약을 했고 이번년도 11월이면 계약만기일자입니다 산지 몇개월쯤 되었을때 비가 새더군요 그래서 계약서에 적혀져있던 번호 저장후 연락을 주고받고 오셨었는데 본인이 동생이라더군요 몇채를 관리하는데 형은 서울로 이사를 가서 여기지역은 본인이 관리한다면서요 그래서 아그렇군요 하고 고쳐지지않아서 1년가까이 연락을 주고받고 얼굴뵙기를 여러번 저도 지쳐서 그래 그냥 냅두자 했습니다 근데 부동산에서 얼마전 연락이 오더군요 집주인이 집을 내놨다면서요 근데 연락이 안된다면서 번호 알려달라더군요 저도 전화해봤지만 이미 바뀐번호구요 그랴서 부동산측이랑 전화를 했더니 사실은 이미 2.3월쯤 집을 내놨고 그뒤로 잠수를 탔다는겁니다 자기도 모른다고 저는 뒤늦게 계약서를 찾아봤고 아차 싶었습니다 계약당시 집주인분은 10분본게 다입니다 그 번호는 저랑 연락주고받았던 동생번호구요 그랴서 알고계셨냐 물어보니 탸연하게 아그래요? 하면서 근데 그사람 친동생 아닌데 ..하면서 ...어처구니가없어서 자꾸 경매에 넘기라더군요여기서 제가 궁굼한건1.부동산도 한패인거 같은 느낌인데 물증은 없습니다 .증거가 문자나 녹취록이 있으면 부동산도 책임을 물을수 있는지 2.내용증명 보내고있고 동사무소가서 초본떼면 바뀐주소지가 나온다더군요 그럼 제가 찾아도 돈없다고 하면 어떻게 해야되는지3.경매에 넘겨지면 돈 다 돌려받을수 있는지 (전세1억에 들어왔고 시세가 많이 떨어져서 지금 8천 언저리입니다)은행에서는 일단 묵시적 연장 가능하다고 하는데 저는 그 집에 살고싶지않은데 못갚으면 제 신용에 타격이 크답니다 만기가 남아서 이러지도 저러지도 못하고있어요 어쩌면 좋을까요.....\n'],"['안녕하세요. 서울지방변호사회 소속으로 지식iN 법률상담을 진행하고 있는 정종욱 변호사입니다.\n\u200b최근 세입자들의 소중한 보증금을 떼어먹는 전세사기가 기승을 부리고 있어 세입자들의 각별한 주의가 필요한 상황입니다. 하지만 사기꾼들의 수법이 워낙 교묘하기 때문에 조심을 한다고 하더라도 눈 뜨고 코베이는 식으로 전세사기를 당하기 십상입니다. 전세사기는 수년간 그 수법이 진화되어 왔습니다.\n전세사기에 대처하는 방법으로는 (1) 형사고소, (2) 보증금반환청구소송, (3) 채권추심/강제집행이 있습니다. 이 세 가지 절차가 유기적으로 진행되어야 전세사기 사건에서 피해를 회복할 수 있습니다. 공인중개사가 전세사기에 적극 가담했다면 (4) 공인중개사 및 중개사협회에 대한 손해배상청구도 생각해볼 수 있습니다.\nHUG 등 전세보증보험을 가입하였다고 하더라도, 석연치 않은 이유들로 보증이행을 하지 않는 경우가 허다합니다. 보증보험회사의 입장에서도 세입자에게 보증채무를 이행한 뒤 집주인에게 구상권을 행사하여 보증금을 회수해야 하는데, 집주인으로부터 보증금회수가 불가능할 경우 이는 고스란히 보증보험회사의 손해로 귀속되기 때문입니다. 이 경우 보증금반환에 대한 부담은 고스란히 세입자가 부담하게 됩니다.\n최근 유행하는 갭투자 전세사기는 결국 갭투자 사기꾼이 남겨놓은 재산을 피해자들끼리 나눠먹기를 하는 형국으로 귀결되는 경우가 많습니다. 따라서 신속한 법적 조치를 취한 쪽이 그렇지 않은 쪽보다 유리할 수밖에 없습니다. 전세사기는 수년동안 그 형태가 진화해왔고, 그 수법이 사안마다 다르기 때문에 사안에 맞는 적절한 해결책을 찾기를 원하신다면 관련 자료를 지참해 전문 변호사와 상담을 진행해보시는 것이 좋습니다.\n참고하실만한 글을 소개해드립니다. 부동산 전세사기 대응방법에 관해서는 아래 글을 참고하시면 도움이 되실 것입니다.\n']"
전세,"['안녕하세요 월세말고 전세는 처음이고 억 단위의 돈을 빌려 개인에게 맡기는 것도 불안해서 부덩산 전문가분들이 계시다면 도움좀 얻고 싶습니다.현재 집을 보고 가계약을 한 상황입니다집은 신축 아파트로 23년5월31일 부터 집을 볼 수있어서 이번에 집을 보고 전세금도 일부 맞춰주셔서 계약하기로 마음먹었는데 제가 계약에 대해 좀 무지한 상태인데 부동산직원분이 집주인과 통화후 가계약금 200을 입금하라고 해서 200을 입금했습니다. 부동산 직원분이 부동산 공급계약서를 보여줬을때 매수자는 A였지만 제가 입금한 계좌주인은 B였습니다.둘은 공동명의라고 해서 그냥 별생각 없이 입금했는데집에와서 또 전세에 대해 이것저것 알아보니 공동명의로 된집을 빌린다는게 찝찝하고, A와B가 공동명의 인지도 모르겠고, 임대차계약금수령확인서도 작성해야 하는건지도 몰랐고 부동산 중개인이 제 인적사항을 문자로 받고 자기가 작성해서 확인서를 대필해서 사진으로만 보내줬습니다. 지금까지는 진행된 상황이고 질문사항 몇개 올려보겠습니다ㅠㅠㅠ1. 신축(2000세대 이상)아파트이고 등기부등본이 나올려면 조금 오래걸린다 들었습니다. 그럼 A와B가 공동명의인지 , 두사람의 지분이 얼마인지 알 방법은 없는건가요?(부동산 직원 말로는 두사람은 부부라 함.)2. 공동명의인 집주인과 전세계약을 할때 계약서 작성시 두사람 다 와야하는지, 와서는 무엇을 특약으로 걸어야 하는지 , 주의사항 등은 무엇이 있을까요?3. 전세금 2억2천 이고 공급계약서 보니 매매금액은 3.6억 이였습니다. 지금은 매매가가 피가 붙어 더 오른 실정이고 부동산 직원 말로는 근저당,융자? 등은 없다고 하였는데 안심해도 될 매물일까요??4. 현재 너무 무지한 상태로 가계약금을 지급했는데 단순히 반환해달라 했을때 반환해줄 의무가 있을까요? 임대차계약금확인서를 부동산 직원이 작성했는데 ㅠㅠ 저는 그냥 그자리에서 입금 빨리해주는게 좋다고 해서 무작정 입금한 죄는 있습니다...조언 및 답변 해주시면 감사하겠습니다 :)\n']","['질문자님께서 작성해 주신 내용을 토대로 답변드리면,\n신축이고 첫입주아파트라면\n공급계약서(분양계약서)를 가지고 전세계약을 진행합니다.\n공급계약서에는 명의자의 인적사항이 나와있어\n공급계약서, 그 명의자 신분증을 토대로 전세계약서를 작성합니다.\n부부공동명의라면 5:5 지분일 확률이 높습니다.\n전세금의 계약금, 중도금, 잔금은\n부부 중 1인의 계좌로 입금하면 되고\n계약서는 부부 2명이 와서 직접 자필서명 또는 도장날인하는 걸 추천드립니다.\n임차인이 전세대출을 받을 경우 전세대출을 진행하는 은행에서\n공동명의자 2인이 직접와서 자필서명 또는 도장날인했는 지 확인합니다.\n전세는 선순위 근저당권 등 담보물권이 없는 상태에서 진행해야\n대항력이 있어 안전하게 전세금을 지킬 수 있습니다.\n불안하시면 계약금을 5% 1천1백만원으로 진행요청하시고\n계약서 작성 전 부동산중개사한테 계약서 초안을 요청하여 읽어보시고\n더 추가로 필요한 부분이 있는 지 검토해보심을 추천드립니다.\n그리고 보증보험까지 가입하시면 더욱 안전하게 진행할 수 있습니다.\n참고하셔서 잘 진행하셨으면 합니다.\n']"
전세,['안녕하세요다가구전세 2년 살고 나갈려는데 집이 안나가서요기한은 다가오는데 주인사장님은 돈 없다 하시고이사간다는 말은 확실히 했는데 이럴경우 집이 안나가면 돈을 어찌 받아야 하나요?전세보증보험도 안해놔서ㅠ부동산에서도 주인이 안 주면 방법 없다 하고답답합니다.. 법으로 해야 하나요?\n'],['안녕하세요.\n부동산은 누구의 편도 아니니 믿지 마시길 바랍니다.\n계약종료 시 퇴거하겠다는 내용을 임대인에게 알리고 임차권등기명령 진행하시길 바랍니다.\n만약 임차권등기명령 후 퇴거하시는 경우 보증금반환 지연이자도 받을 수 있습니다.\n모쪼록 잘 해결되시기를 바랍니다.\n도움이 되셨다면 채택 부탁드립니다.\n감사합니다.\n']
전세,['임대인 입니다. ^^ 전세계약 1년 채결하고 1년 종료시점에 전세입자가 그 상태로 매매계약을 채결할 경우 부동산 전세계약서에 특약사항으로 약속된 매매가에 1년 전세종료시점에 그대로 매매한다는 내용이 있으면 법적 효력이 있는지 궁금합니다. 부동산 중계인은 걱정된다며 우려를 표하고 있어요. 전세 매매 계약서 동시에 진행하고 싶지만 동일 물건에 두가지의 거래는 어려울거 같다 생각되서 그냥 특약사항에만 추가하려는데. 만약 아파트 가격이 떨어지면 종료시점에 매매취소를 주장한다면 어찌되는지 궁금해요.\n'],['안녕하세요. 서울지방변호사회 소속으로 지식iN 법률상담을 진행하고 있는 정동운 변호사입니다.\n약속된 매매가에 1년 전세종료시점에 그대로 매매한다고 기재하셨는데\n임대차계약 종료시 약정된 매매대금을 지급하였다면(즉 임대차보증금이 매매대금으로 전환되어 일부 매매대금이 기지급된 것임) 계약 당사자가 임의로 계약을 해제할 수는 없습니다.\n원칙상 임대차계약서와 매매계약서를 별도로 작성하지만 임대차계약서 특약사항으로 매매약정을 기재해도 법적 효력이 있습니다.\n이상과 같이 답변 드립니다. 감사합니다.\n변호사 정 동  운 올림.\n']
