구분,질문,답변
전세,"['제가이번에 지방에서 서울가기위해 lh전세대출 2순위 청년으로 집을 보러갔는데요 제가 월세만살다보니 그냥 집만보고 나와 계약하겠다고 했습니다 어짜피 lh에서 전세자금을 줄테니까요 그리고 가계약금? 어떤것 작성안하고 공인중개사랑 집주인이랑 전화하더니 100만원 입금 하면 된다고 해서 그냥 입금했습니다 그리고 이틀뒤 아버지에게 이야기하니 등기부등본 봤냐고 물어봤습니다 저는 ""안봤는데요 ,lh 하면 거기서 대출해줄지안해줄지 해줄거에요"" 라고이야기하니 그래도 부동산에이야기해서 등기부등본 보여달라고 이야기 하라고해서 이야기해서 등기부등본을 봤는데 22.8.29일날 1억원에 매매를 했다기 적혀잇었습니다 근데 제가 9100만원에 전세를 하기로 했거든요 아버지가 이가 깡통 될수도있다고 이야기를하십니다 (요즘 서울 전세 가격이 많이 떨어져서라고 합니다)제가 궁금한것은1. Lh에서 심사받고 계약을 진행했다가 추후 아버지가말한 깡통이되면 제가 lh에 대출받은 8900만원은 제 빚이 되는건가요?2. 매매(22.8.29) 1억 원룸 전세 9100 괜찮나요??3. 만약 취소시 가계약금 받을수 있을까요??(현재lh심사 권리주택심사완료단계입니다)(부동산에서 제가 보여달라고하기전까지 등기부등본을 보여주지않고 집만보여주고 계약하실건가요? 라고 물어봤었습니다)4. 지역은 신대방쪽입니다\n']","['깡통맞아 부린이야.\n깡통이잖아.\n80% 하라고.\n니들 문제가 뭐냐면 80% 산수 못해서\n죄다 빌라왕 사기 당하는 중. ^^\n바보아저씨의 경제이야기 - 대한민국 만연한 미친 갭투기의 실제와 방법 폭로\n집 1억\n내돈 2000 + 전세 8000 (이 돈은 집 판사람한테 있습니다.)\n내돈 1000 + 전세 9000\n내돈 500 + 전세 9500 (이런데 들어가는 전세입자 많아요.)\n세입자 줄 8000만원~9500만원 전세금 집주인들 없어요.\n뒤에 세입자 돈 들어와야 님 주죠.\n이게 갭투기 기본인데요?\n1.2억 되면?\n-> 내돈 2000 -> 4000만원 2배 수익\n-> 내돈 1000 -> 3000만원 3배 수익\n-> 내돈 500 -> 2500만원 5배 수익\n8000만원 되면?\n-> 내돈 0원 망하고\n-> 집 경매로 그냥 넘기면 됨\n끝.\n전세금 없으면?\n당연히 없죠.\n뒤에 세입자 돈 받아서 주겠다\n배째라 하면 됨\n고민 끝.\n초등학교 때 산수 배우는 이유입니다.\n설명끝.\nㅊㅊ\nㅊㅊㅊㅊ,ㅊㅊㅊㅊ\n지금 뭐가 뭔지 전혀 모르는 상태잖아요.\nHUG 전세보증 공시가 140%~150% 가능하죠.\n- 매매 1억인데\n- 공시 5000 X 140% = 7000전세 까지 보증 가능한데\n- 매매 1억인데\n- 공시 8000 X 140% = 1.12억 까지 보증이 나와\n-> 1200만원 역전세 사기 당한다고\n[빌라]\n매매 2.5억\n공시 2.0억 X 150%\n전세 3.0억\n=> 전세 보증보험 가능 + 5000만원 역전세 사기\n바뀐 집주인(서울역 노숙자) + 압류 + 체납 + 잠적 + 연락두절 -> 고의 경매 파산\n이게 전세 HUG 안심 보증의 숨은 뜻이야\n제발 정신 좀 차리세요.\n전세금 1.00억 안전하려면\n융자 없이\n매매가 1.25억 이상나와야\n집 80% 경매 낙찰로 망해도 안전합니다.\n깡통전세 조심하시구요.\n공시가 말고\n매매가 80% <- 무조건 이거 좀 하시라구요.\n전세 근저당 계산 방법 - 전세 사기 당하지 않는 방법\nhttp://naver.me/GEQmeYQ6\n[빌라왕] HUG전세보증보험, 드러나는 국가주도 역전세 사기극\nhttps://naver.me/G1Fo6aU9\n[빌라왕] HUG전세보증보험 90% 축소 뜻 -> 10% 갭투자 사기 무조건 쳐라.\nhttps://naver.me/GvX1PyKi\n너희 초년생들 문제가 뭐냐면\n- 80% 산수만 하면 전세사기 피할 수 있는데\n- 아무것도 모르면서 HUG 찾아서 빌라왕 사기 당하고 있다는 거지.\n너무\n안타깝다 정말...\nHUG = 역전세 빌라왕 주범이라고.\n사회초년생들아...;\n유튜브 SNS로 부동산을 배우니,,, 죄다 빌라왕 사기를 당했죠....\n']"
전세,['전세계약 갱신 계약서 작성하는데 꼭 부동산을 껴야 안전한건가요?계약서 내용은 문제 없는 것 같고 확정일자는 기존에 받아놓은게 있어서 안 받으려고 해요.아니면 받는게 나을까요..?\n'],['']
전세,['신탁 등기된 부동산 전세계약을 하려고 합니다.\xa0 신탁사와 우선수익자의 동의 있는 상태로 전세계약 체결하면위탁자에게 보증금을 보내도 문제 없는건가요?\n'],"['바보네.\n신탁말소 근저당0\n니가 1순위\n-> 빌라왕 사기 당첨\nㅊㅊ\nㅊㅊㅊㅊ,ㅊㅊㅊㅊ\n신탁 말소하고 -> 매매가 80% 이하 전세금 확인하라고. 초등학교 산수 아님?\n신탁 말소하고 -> 매매가 80% 이하 전세금 확인하라고. 초등학교 산수 아님?\n신탁 말소하고 -> 매매가 80% 이하 전세금 확인하라고. 초등학교 산수 아님?\n신탁 말소하고 -> 매매가 80% 이하 전세금 확인하라고. 초등학교 산수 아님?\n신탁 말소하고 -> 매매가 80% 이하 전세금 확인하라고. 초등학교 산수 아님?\nㅊㅊ\nㅊㅊㅊㅊ,ㅊㅊㅊㅊ\n매매 2.5억\n공시 2.0억 X 150%\n전세 3.0억\n=> 전세 보증보험 가능 + 5000만원 역전세 사기\n바뀐 집주인(서울역 노숙자) + 압류 + 체납 + 잠적 + 연락두절 -> 고의 경매 파산\n1채 사기 + 5000만원\n10채 사기 5억\n100채 사기 50억\n1000채 사기 500억 -> 수리남 송금\n바지 사장 20대는 => 살해\n신탁 말소 + 빌라왕 사기 당첨\nㅊㅊ\nㅊㅊㅊㅊ,ㅊㅊㅊㅊ\n- 집주인 대출 없네요~\n- 전세보증보험 들었네요\n- 1순위 전세권 설정이네요 (확정일자+전입신고)\n-> 그런데 전세사기 당하는 쓰레기 국가\n말소하고 + 보증보험 들고 + 니가 1순위 전세인데\n전세 사기 당한다고\n-----\n지금 뭐가 뭔지 전혀 모르는 상태잖아요.\nHUG 전세보증 공시가 140%~150% 가능하죠.\n- 매매 1억인데\n- 공시 5000 X 140% = 7000전세 까지 보증 가능한데\n- 매매 1억인데\n- 공시 8000 X 140% = 1.12억 까지 보증이 나와\n-> 1200만원 역전세 사기 당한다고\n[빌라]\n매매 2.5억\n공시 2.0억 X 150%\n전세 3.0억\n=> 전세 보증보험 가능 + 5000만원 역전세 사기\n바뀐 집주인(서울역 노숙자) + 압류 + 체납 + 잠적 + 연락두절 -> 고의 경매 파산\n이게 전세 HUG 안심 보증의 숨은 뜻이야\n제발 정신 좀 차리세요.\n전세금 1.00억 안전하려면\n융자 없이\n매매가 1.25억 이상나와야\n집 80% 경매 낙찰로 망해도 안전합니다.\n깡통전세 조심하시구요.\n전세금 2.00억 안전하려면\n융자 없이\n매매가 2.50억 이상나와야\n집 80% 경매 낙찰로 망해도 안전합니다.\n깡통전세 조심하시구요.\n공시가 말고\n매매가 80% <- 무조건 이거 좀 하시라구요.\n전세 근저당 계산 방법 - 전세 사기 당하지 않는 방법\nhttp://naver.me/GEQmeYQ6\n너희 초년생들 문제가 뭐냐면\n- 80% 산수만 하면 전세사기 피할 수 있는데\n- 아무것도 모르면서 HUG 찾아서 빌라왕 사기 당하고 있다는 거지.\n너무\n안타깝다 정말...\nHUG = 역전세 빌라왕 주범이라고.\n사회초년생들아...;\n유튜브 SNS로 부동산을 배우니,,, 죄다 빌라왕 사기를 당했죠....\n[빌라왕] HUG전세보증보험, 드러나는 국가주도 역전세 사기극\nhttps://naver.me/G1Fo6aU9\nHUG 전세보증보험의 실체 = 국토부가 설계한 빌라왕 사기\nhttps://naver.me/5i0eKYHT\n신탁 말소하고 -> 매매가 80% 이하 전세금 확인하라고. 초등학교 산수 아님?\n신탁 말소하고 -> 매매가 80% 이하 전세금 확인하라고. 초등학교 산수 아님?\n신탁 말소하고 -> 매매가 80% 이하 전세금 확인하라고. 초등학교 산수 아님?\n신탁 말소하고 -> 매매가 80% 이하 전세금 확인하라고. 초등학교 산수 아님?\n신탁 말소하고 -> 매매가 80% 이하 전세금 확인하라고. 초등학교 산수 아님?\n']"
전세,"['우선 저는 2022년 5월 10일자에 보증금 5000만원에 2024년 5월 9일까지 전세계약을 했습니다.특약에는 잔금일까지 저당 말소 및 소유권을 제한하는 새로운 권리변동을 일으키지 않는다고 넣어놨었습니다.그리고 현재까지 다른 저당은 없는 상태입니다.그런데 2023년 9월 24일자에 우연히 제가 전세계약한 날(2022년 5월 10일)에 집주인이 바뀌었다는 것을 알게 되었습니다.\xa0제가 전세계약하는 과정 및 2023년 9월 24일자까지 집주인이 바뀐다는 내용은 전혀 알 수 없었습니다.저는 전세사기 등 다양한 의혹이 들어 그 다음날 전집주인과 새집주인에게 대법원 판결에 따라 전집주인에게도 전세금반환 의무가 있으며 새집주인에게 임대차계약 종료 및 전세금 반환을 요청했습니다.그리고 새집주인은 새로운 세입자가 나타나면 보증금을 돌려주겠다고 했습니다.복비는 새집주인이 지불하기로 했으며 부동산에 올려는 놨으나 현재 새로운 세입자는 나타나지 않고 있으며 전세반환보증보험은 들어 놓지 않은 상황입니다.그리고 현재 아파트 가격은 제가 들어올 때까지는 매매 6500 전세 5500이 시세였으나현재 아파트 가격은 4300까지 떨어져 있으며 5000~5500선에서 형성되어 있습니다.\xa0역전세 현상으로 이전 2년전 전세가격인 5000만원에는 새로운 세입자가 구해지지 않는 상황입니다.지금 현재 제가 생각하고 있는 방법은\xa0첫 번째 제가 모르게 전집주인과 새집주인 사이에 매매과정에서 문제가 발생하였으므로 임대차 계약 종료 및 형사+민사소송을 진행하는 것이며,두 번째 방법은 전세금을 4000만원정도로 낮춰 1000만원 돌려받고 전세보증보험 및 새집주인과 전세계약을 새로 채결하는 것입니다.여기서 제가 궁금한 점은제가 모르게 전세계약 당일 매매계약이 이루어져 집주인이 바뀌었는데 굳이 새로운 세입자가 나타날 때까지 기다려줄 필요가 있는지만약 소송으로 가게 되면 대법원 판례에 따라 전집주인과 새집주인 양측에 보증금 반환 청구가 가능한지최악의 경우에 경매로 넘어가서 보증금 이하인 4000만원선에서 낙찰되면 나머지 1000만원 및 지연이자 12퍼센트 및 변호사 선임비용등은 청구 가능한지그리고 대법원 판례가 세입자 모르게 집주인이 바뀐 경우 임대차 종료를 할 수 있으나 상당한 기간 내에 이의를 제기하여야 한다고 되어있는데 이 상당한 기간이 어느정도인지 궁금합니다.가급적 좋게 끝내고 싶어서 새로운 세입자가 나타나길 기다리고 있으나 대법원 판례 중 상당한 기간 내에 이의를 제기하여야 한다고 되어 있어서 마냥 기다리기만 해도 되는 것인지 궁금합니다.현재는 일단 제가 집주인이 바뀐 걸 알게 된 9월 24일자로부터 한 달정도 새로운 세입자가 나타나는 걸 기다려보고 나타나지 않을시 새집주인과 통화하여 소송 또는 전세 재계약 중 하나를 요구할 생각입니다.\n']","['법무법인 와이케이 윤영석 변호사입니다.\n전세계약(엄밀히는 임대차계약입니다) 당일에 집주인이 바뀌는 것은 대단히 이례적이므로, 사기 등 범죄의 가능성이 충분히 있습니다. 관련 서류나 계약서에 이례적인 특약이 숨어 있는 것은 아닌지 꼼꼼히 따져 보아야 합니다.\n전세(임대차)계약이 끝나면 임차권자는 주택을 반환하고 상대방은 보증금을 반환하여야 합니다. 다음 세입자를 구하지 못하였다 하여 보증금을 반환하지 않아도 되는 것은 아닙니다. 이 때는 보증금반환 지연에 따른 손해배상을 추가로 청구할 필요가 있고 기타 여러 제재수단을 동원하여 임대차보증금을 받아낼 필요가 있습니다.\n집주인이 임대차보증금을 돌려주지 않고 끝까지 버틴다면 상당히 골치아픈 상황이 벌어지게 되므로, 초창기부타 강력한 대책을 시행하여 상대방에게 얕보이지 않는 것을 추천드립니다. 상대방의 사정을 하나하나 봐주다 보면 임차인의 손해만 커질 뿐입니다. 초창기부터 강경책으로 나가는 것이 손해를 줄이는 길입니다.\n(문의 031-692-2886   010-4667-4549)\n']"
전세,"[""안녕하세요. 이번에 급하게 집을 구하게 된 청년입니다.오늘 계약서를 작성하고 임차보증금의 5%되는 가계약금을 넣고 왔습니다.부동산 매물을 볼 당시와 현재 매물 소유주가 건축주<<이며,저에게 따로 '공동주택 공급계약서'를 보여주시며 임대인이 될 분의 매매내역을 보여주셨습니다.(전세가와 매매가 대략 1억5천~2억정도 차이 남.)+ 오늘 은행 중 한 곳에서 주변 시세 매매가 보다 많이 높다며 조심하라고 주의주셨습니다.ㅠㅠ(주변 부동산 4곳에서는 일단 제가 아는 매매가가 실거래되었다고 말씀듣긴했으나 불안합니다.)계약서 작성 시 설명듣기로는 건축주 앞으로 근저당권이 잡혀있지만매매하신 임대인 분 앞으로 승계하면 근저당권이 소멸된다고 설명 들었습니다.중개인 분이 구두로 (HUG)보증보험료 100% 임대인 측에서 부담, 관리비 5만원 2년치 대납이라고 말씀.오늘 계약서를 작성하고보니'관리비는 7만원이며,(중략)관리업체 내규 변동사항에 따르기로 한다.'라고계약서에 명시되어 있어, 제가 알게 모르게 속임 당한 것인지 불안하고 궁금합니다.(구두로만 말씀, 관리비나 보증보험료 관련하여 계약서에 명시X)또한 현재 소유주가 건축주로 되어있어 등기부등본 상 융자가 있어\xa0방문한 은행들 중 한 곳은 대출이 원칙상 어렵다고 거절하기도 했습니다.설명듣기로 제가 대출심사를 정상적으로 완료하고 입주할 때 즈음매매하기로 한 임대인 분께 그대로 전세계약 내용 승계한다고 전달 들었는데.. 문제 없을까요? ㅠ처음 전세라 나름 알아보고 간 것인데도 많이 불안하고 걱정이 많습니다....친한 동생이라 생각하시고 자세히 조언해주신다면 정말 감사하겠습니다.. ㅠㅠㅠㅠㅠ-----------------------------------------------------------------------------------계약서 특약사항은 아래와 같습니다. (문제시 삭제하겠습니다.)'임대인은 임차인의 청년버팀목(HUG)전세자금대출 및 전세보증보험 가입에 적극 협조하기로 하며, 대출 및 보증보험 불가 시 본 계약은 파기되며 계약금 전액을 반환하도록 한다.(무효로 한다.) 단, 임차인의 개인변심 또는 대출실행 비협조 및 승인자서 후 계약파기 시 계약금은 위약금 처리한다.''임대인은 임차인의 확정일자 및 전입신고 기준 익일까지 임차 주택에 추가 저당권 및 담보권 설정을 하지 않고 임차인이 선순위보장을 받을 수 있게 한다.''임대인은 임대차 기간 중 임대인 변경 시 임차인에게 고지해야하며, 현 전세계약을 동일하게 승계하도록 한다.''현재 설정된 근저당은 잔금시 전액 말소하고 임대차 기간 중 제한물권 및 근저당권 설정하지 않기로 한다.''본 계약은 건축물대장 및 등기부등본을 통해 건축물 현황 상태 및 근저당권 유무와 등기명의인 확인, 설명 하였고, 국세.지방세 미납사실이 없음을 확인설명하였음. 계약에 명시되지 않은 사항은 주택임대차 보호법 및 민법과 주택임대차 계약의 일반관례를 따른다.'-----------------------------------------------------------------------------------+ 예시로 대출 2억이 필요하여 요청했는데 심사에서 2억 미만으로 대출이 나온다면위 조건의 계약서가 파기가 되는지 여부도 궁금합니다.\n""]",['청년 전세 대출을 받고 싶지만 어떤 전세 대출을 받아야 할지 모를 때는 이 글을 꼭 보셔야 합니다. 이 글에서 청년들이 받을 수 있는 1.청년 버티목 전세대출 2.중소기업 청년 전세대출 3.카카오뱅크 청년 전세대출 4.허그 안심대출 총 4개 종류의 대출을 알려드립니다. 대출 조건 확인하시고 나에게 맞는 대출 선택해보세요.https://imfomation123.com/%ec%b2%ad%eb%85%84-%ec%a0%84%ec%84%b8-%eb%8c%80%ec%b6%9c-4%ea%b0%9c-%eb%b9%84%ea%b5%902023%eb%85%84-%ec%a3%bc%ec%9d%98%ec%82%ac%ed%95%ad/\n']
전세,['안녕하세요! 제가 5억5천짜리 빌라 전세계약을 했는데요 (아직 잔금 전)그 빌라 매매가가 7억5천이라고 해서 안심하고 계약했습니다. 빌라 소유주는 아직 안 팔려서 시공사와 시행사로 되어있구요. 근데 갑자기 이 빌라를 6억5천에 전세끼고 1억에 갭투자 급매하겠다는 광고가 떴어요. 전세계약이 되어있는 상태인데 이 집을 시행사가 갑자기 갭투자로 팔수도 있는건가요?? 너무 불안합니다ㅜ 답변 부탁드려요!\n'],['안녕하세요. 서울지방변호사회-네이버 지식iN 상담 변호사 전범진 입니다.\n임대인 명의가 시행사인가요?\n그렇다면 시행사가 전세 끼고 갭투자 원하는 매수인에게 매도할 수 있습니다.\n7억 5천에서 1억이 내려가니 경매되면 위험할 수도 있겠네요\n']
전세,"['전세로 살집을 알아보는 중입니다. 알아보던 도중 괜찮은 집을 찾아 부동산에 문의를 해보았는데임대인이 신축을 매매를 했는데 매매한 돈에 반만 지불을 한 상태라고 합니다. (즉, 계약금을 걸어놓은 상태)근데 그 나머지 반을 이제 세입자인 저 같은 사람에게 돈을 받고 그 다음에 임대인이 그 건물에 대한 명의등록이 된다고 하는데... 공식적으로는 임대인이 아니라 건축주가 그 건물에 명의가 되어 있다고합니다...신축 건물 전세 계약은 보통 이렇게 하는 사람이 많나요?전세 사기가 많아 불안합니다.\n']",['안녕하세요 구자왕 이빈다.\n매수자가 세를 맞춰서 매매하는 갭투자로 보입니다.\n이론상 문제될 건 없습니다만\n조금 더 안전하게 진행을 희망하신다면\n계약금 및 잔금을\n바뀌는 집주인이 아닌 매도를 하는 집주인에게 보내어\n기존 집주인과 전세계약을 먼저 체결 후 잔금치루기 전 전입신고와 확정일자를\n미리 받아두시는걸 권합니다.\n[블로그]\nhttps://blog.naver.com/goodmen39\n위 블로그에도 비슷한 설명 올렸으니 참고 바라며\n더 궁금하신 건 추가질문 또는 1:1 질문 남겨주세요.\nhttps://kin.naver.com/qna/question.nhn?u=b1YQ%2FSD6YG4j5eS15%2Bx2yCjOY4JGkSM7Ff8ueMysFSQ%3D\n']
전세,"['안녕하세요,\xa0 제가 2년 반 전 주식회사 소유의 부동산을 전세로 계약했습니다.2년의 거주기간이 만료되고 묵시적 계약 갱신으로 계약이 2년 연장되었습니다.부동산 소유가 (주식회사)라서 전세대출이나 전세보증보험 모두 안된다고 했습니다.계약당시는 주식회사 대표분이 나오셔서 부동산에서 같이 계약했구요.질문1. 아직 계약기간이 1년 반 남았는데, 사정이 생겨 집을 빼야할 경우\xa0집주인에게 이 사실을 알리면 보증금을 바로 받을 수 있나요?아니면 부동산을 통해 새로운 세입자를 제가 구해야 보증금을 받을 수 있나요질문2. 혹시 회사가 중간에 잘못되어 부도 같은 최악의 상황이 생긴다면 이 집은 어떻게 되는건가요?임차인은 대항력만 유지하고있다면(전입신고, 확정일자 유지) 전세금을 모두 반환받을 수 있나요?\n']","['질문1. 아직 계약기간이 1년 반 남았는데, 사정이 생겨 집을 빼야할 경우\n집주인에게 이 사실을 알리면 보증금을 바로 받을 수 있나요?\n아니면 부동산을 통해 새로운 세입자를 제가 구해야 보증금을 받을 수 있나요\n<답변> 임대인에게 보증금 반환을 요구해 보셔야 합니다.\n만기가 남아 있어서 반환 받기는 좀 어려울 것입니다.\n안 준다고 해도 만기가 있어서 임대인에게 잘못을 따지지는 못합니다.\n질문2. 혹시 회사가 중간에 잘못되어 부도 같은 최악의 상황이 생긴다면 이 집은 어떻게 되는건가요?\n임차인은 대항력만 유지하고있다면(전입신고, 확정일자 유지) 전세금을 모두 반환받을 수 있나요?\n<답변> 연장이 안 된다면 전세자금 대출을 갚아야 합니다.\n임대인도 은행에 입금을 하지 않는다면 임대인, 임차인 모두 신용에 문제 생깁니다.\n부도 등이 나도 1순위로 대항력, 우선 변제권이 있다면 보호는 받지만, 신용에는 문제 생깁니다.\n']"
전세,"['A부동산에서 전세집을 보려고 갔는데B부동산과 같이 안내를 받은 상황입니다.전세계약 시 A부동산,B부동산과 공동으로 진행한다고 하는데이런 경우도 있나요?그리고 이때 중개수수료는 어떻게 되는지 궁금합니다.\n']","['전세계약 시에도 여러 부동산과 함께 공동으로 진행하는 경우가 있을 수 있습니다. 중개수수료는 보통 전세금의 일정 비율로 책정되며, A부동산과 B부동산 각각에게 수수료를 지급해야 할 수 있습니다. 하지만 정확한 내용은 해당 부동산들과 상담하여 확인하는 것이 좋습니다.\n']"
전세,['상속 부동산 전세보증금 반환 질문에 대해 궁금한 점이 있습니다 아파트 전세를 주고 나서 아버지가 편찮으셔서 매매를 내놓고 계약금과 일부 금액을 받은 후 아버지가 사망하셨습니다\xa0 \xa0 상속등기는 형제 3명 협의 분할로\xa0 진행 중이며\xa0 \xa0 \xa0 잔금일자에\xa0 새로운 매도인이\xa0 대표 상속인에게 입금을 해서 보증금 반환 후 남은 금액을 협의분할 지분 만큼 분배 해도되는지\xa0 \xa0 \xa0 \xa0 \xa0아니면\xa0 \xa0 협의분할에 적혀 있는 상속인 3명에게 각자 입금을 하고 그 지분만큼 세입자 에게 입금을 해야하는지\xa0 \xa0궁금합니다\xa0추가로\xa0 \xa0새로운 집주인이\xa0 상속등기인에게 입금을 먼저 안하고\xa0 \xa0 세입자에게 전세 보증금을 돌려주고\xa0 남은 차액을 상속등기인 지분만큼 입금을 받아야하나요??\n'],['']
전세,"['비수도권에 카카오뱅크 청년 전세대출을 받아서 전세로 이사를 가려고 합니다. 제가 부동산 관련해서는 완전 무지한 상태라 계약 과정을 알려주실 수 있나요? 예를 들어서, 부동산을 통해 집을 알아볼건데 집 몇군데를 돌아다니다가 마음에 드는 집이 있으면 그 집 등기부등본을 받아서 확인 후 추후에 다시 부동산에 연락드리는게 가능할까요? 선순위채권이랑 근저당을 보라고 하시던데 뭐가 뭔지는 자세히 잘 몰라서 집에 들고와서 자세히 보려고 하는데 못들고가게 하면 어떡하나요? 부동산통해서 계약을 진행하게될 때 진행과정같은 경우를 알려주세요\n']","['예를 들어서, 부동산을 통해 집을 알아볼건데 집 몇군데를 돌아다니다가 마음에 드는 집이 있으면 그 집 등기부등본을 받아서 확인 후 추후에 다시 부동산에 연락드리는게 가능할까요? 선순위채권이랑 근저당을 보라고 하시던데 뭐가 뭔지는 자세히 잘 몰라서 집에 들고와서 자세히 보려고 하는데 못들고가게 하면 어떡하나요? 부동산통해서 계약을 진행하게될 때 진행과정같은 경우를 알려주세요\n---> 이런 내용을 잘 체크 해 보시고 참고하여 진행을 하시면 크게 문제는 없겠지요\n1)주의 사항\n1) 그 집의 전세가율(전세가/시세)이 70%를 밑도는지 확인하시고 넘는다면 반전세로 계약을 하시고\n2) 등기부를 열람하여 등기부 갑구에 압류, 가압류, 가처분 등기가 있는지 확인하시고\n3) 등기부 을구에 과도한 저당권(시세의 30% 이상)이 있는 경우는 가급적 계약을 하지 마시고\n4) 계약금이나 잔금 등 금전수수를 할 경우는 등기부상 ""소유자""명의의 계좌로 이체를 하시면 되겠고.\n5) 가능하면 단독다가구 주택, 법인이 주인인 주택(대출, 보험가입이 어려움)을 피하는 것이 좋겠지요.\n2) 대출 프로세스\n5%이상 계약금걸어 계약---> 그 계약서에확정일자 받음---> 1개월 못 남기고융자상담 받음--->심사 및 승인\n기간(2주) 기다림---> 승인되면잔금일에 대출 실행하여 임대인 계좌에 이체--->임차인의이사 및 전입신고---\n>주민 등본 은행에 제출하면 끝나겟지요\n']"
